{
  "canonical_event_id": "FED_DECISION_DEMO",
  "name_en": "Federal Reserve policy decision — demo",
  "name_zh_tw": "聯準會利率決策－示範",
  "category": "FED_POLICY",
  "event_window_start": "2026-10-01T00:00:00Z",
  "event_window_end": "2026-10-31T23:59:59Z",
  "market_refs": [
    {
      "venue": "polymarket",
      "venue_market_id": "demo-poly-fed"
    },
    {
      "venue": "kalshi",
      "venue_market_id": "demo-kalshi-fed"
    }
  ],
  "comparability": "HIGH",
  "comparability_score": 0.92,
  "reasons": [
    "SAME_EVENT",
    "SIMILAR_OUTCOME",
    "ALIGNED_RESOLUTION_WINDOW"
  ]
}
